{"schema":"FbxMappingDecisionFragment.v1","bundleId":"0d38bbb9268262df239f4e7c1655bb4b609d30988aebab6b6a07e3dc550deb47","worklistId":"e0023b4b94c88915f00898e1abf12a8fa4949733347fd203067c70c54aaf523f","sourceGraphCanonicalSha256":"074d508c10bcd3fae5903d65447fb56c63cc909a2aeb3108b9f47df127d3748e","shardId":"180fd346aa587d8c36616e7b0d87d14c39eafa4ff30335303dd629c94858648b","decisions":[{"workItemId":"work-45e3e4ad547b5e7d4706e96c249c292a312872fb51db9b04129a2c3c73db4414","disposition":"exclude-with-reason","reason":"cli test"},{"workItemId":"work-6a5bf2212ae0c1510ba214e70ca8fb4d39326a462bf68226cf18962071cc3a5f","disposition":"exclude-with-reason","reason":"cli test"}],"fragmentId":"9fae1364b5bf8f2860d92adc827b536abee288f9b0db12e429c23164ec0207b2"}