{"schema":"FbxMappingDecisionFragment.v1","bundleId":"0d38bbb9268262df239f4e7c1655bb4b609d30988aebab6b6a07e3dc550deb47","worklistId":"e0023b4b94c88915f00898e1abf12a8fa4949733347fd203067c70c54aaf523f","sourceGraphCanonicalSha256":"074d508c10bcd3fae5903d65447fb56c63cc909a2aeb3108b9f47df127d3748e","shardId":"5f7435290f5fe8e12e0200088c24b36c1d38aec88c6fd17095b58a9f7c128337","decisions":[{"workItemId":"work-9ab44ab4f7eaf5cc6f3f8bebd87db51a6d7ca7145dc63f1c112bbb19336ecb52","disposition":"exclude-with-reason","reason":"cli test"},{"workItemId":"work-ec550fc7c3856c107311ec675db521aa4ea21ac49103f7581f1ddfedef3acb18","disposition":"exclude-with-reason","reason":"cli test"}],"fragmentId":"71e736a3888381484a2795846101012ff5b9ea09a858f3b1438ee6075c50c888"}