{"schema":"FbxMappingDecisionFragment.v1","bundleId":"0d38bbb9268262df239f4e7c1655bb4b609d30988aebab6b6a07e3dc550deb47","worklistId":"e0023b4b94c88915f00898e1abf12a8fa4949733347fd203067c70c54aaf523f","sourceGraphCanonicalSha256":"074d508c10bcd3fae5903d65447fb56c63cc909a2aeb3108b9f47df127d3748e","shardId":"6b0d3aea6478bd9fee49cc3a0bbdde7616cb7884a8b1a40f20de09ec1871bb9f","decisions":[{"workItemId":"work-05fe79465c813df137db1102f34f6ba12dc54c28eda472d32314267aeb55be1e","disposition":"exclude-with-reason","reason":"cli test"},{"workItemId":"work-1776b9d843317ab6e7f3c91b985045c6f167a04bbd088e0781c13370ced9dae9","disposition":"exclude-with-reason","reason":"cli test"}],"fragmentId":"a501fb8458cb1981bcbd3662bd324ef732298a361c8f54e1577f41990c2d73ca"}