{"schema":"FbxMappingDecisionFragment.v1","bundleId":"0d38bbb9268262df239f4e7c1655bb4b609d30988aebab6b6a07e3dc550deb47","worklistId":"e0023b4b94c88915f00898e1abf12a8fa4949733347fd203067c70c54aaf523f","sourceGraphCanonicalSha256":"074d508c10bcd3fae5903d65447fb56c63cc909a2aeb3108b9f47df127d3748e","shardId":"1bde5dc443d1d96b3864228c1eca12728a51e6a60d99d62d63ba317df4695659","decisions":[{"workItemId":"work-ede75f091adeecee3e774bacc37f0fade976f528c7ed8038c3d14c746bba24a6","disposition":"exclude-with-reason","reason":"cli test"},{"workItemId":"work-f212a8ed8b1553bfb43baa883b21a4c958ec188acf469a153e456695ff06d7d2","disposition":"exclude-with-reason","reason":"cli test"}],"fragmentId":"6468002d84934acb947fac6aa6013ed9e6350b717f99c95ecd188160c540d0a1"}